,title,ingredients,instructions
1,Азербайджанский плов,Рис — 4 стак. | Вода | Соль | Масло сливочное | Шафран,"Минимум за 3-4 часа до приготовления плова возьмите 4 чашки риса и промойте как следует. Залейте водой, посыпьте сверху солью и оставьте в стороне. Очень важно замочить рис заранее, т.к. тогда он будет легче и быстрее вариться. Я обычно замачиваю рис с ночи. Возьмите чашечку, всыпьте в него шафран. Залейте его кипятком, накройте блюдечком и дайте отстояться минимум часа 4 (я его завариваю тоже с ночи). Очень важно, чтобы вы накрыли его блюдечком, чтобы аромат шафрана ""не убежал"". | Возьмите кастрюлю. Кастрюля не должна быть маленькой. Я на 4-5 стаканов риса беру 5-ти литровую кастрюлю. Наполните кастрюлю водой (воды так же должно быть много, т.к. рис набухает при варке) и поставьте на сильный огонь. Засыпьте соль, не скупитесь на соль. Недосоленный рис - невкусный, а рис требует много соли, чтобы быть соленым. Как вода начнет закипать, вылейте из миски с замоченным рисом воду, и оставшийся рис высыпьте в кипящую воду. Тут же перемешайте рис, иначе он сварится комками. Процесс варки недолгий, зависит от того, когда вы замочили рис. Занимает около 5-10-ти минут. Рис должен стать длиннее, а на вкус он должен быть полусваренным, т.е. не очень мягким, не очень твердым. Этот момент очень важен, т.к. от этого зависит конечный результат. | Как вы увидите, что рис дошёл до нужной концентрации, вылейте все в сито, прополоскайте кастрюлю, чтобы на дне не оставалось ни одной рисинки. На дно кастрюли вылейте растопленное масло так, чтобы дно покрылось хорошо маслом, не жалейте масла. Положите или лаваш, отрезанный по форме дна кастрюли или специальное тесто (отдельно высталю рецепт этого теста чуть позже), которое впоследствии становится хрустящей вкусной коркой, которая называется газмах. https://www.povarenok.ru/recipes/show/1792/ На тесто (лаваш) засыпьте приготовленный рис (помогайте деревянной ложкой, не бухайте рис прямо в кастрюлю, а кладите ложками, т.к. от этого рис будет рассыпчатым). Проделайте дырки в нем концом деревянной ложки, как следует залейте рис растопленным сливочным маслом ( где-то наверное полстакана или 3/4 стакана) распределите пол-стакана воды по рису, положите кастрюлю опять на огонь, заверните крышку кастрюли в марлечку или полотенце, которое хорошо впитывает влагу в себя, накройте кастрюлю и поставьте завариваться на очень слабый огонь. Через 15 минут возьмите крышку с кастрюли и залейте рис шафраном. Положите крышку обратно на кастрюлю и доваривайте рис до готовности около 1-2 часа / в зависимости от количества риса и размеров кастрюли. Готовность определяется по внешнему виду. Рис должен торчать в разные стороны и от него должен исходить ароматный пар. | Отложите ""жёлтый"" (шафранный) рис из кастрюли в тарелку. На блюдо вначале положите оставшийся рис (белый или полужелтый), а потом сверху положите желтый рис. Если у вас на рисе остались ниточки шафрана, не выбрасывайте его. Он придаёт только красоту вашему рису. Если у вас есть возможность добраться до слоя теста (лаваша), то отделите его от дна кастрюли, нарежьте его ромбиками и положите рядом или в тарелочку или по бокам риса на блюде. К плову подаются разные приправы, как например уже описанная мной сябзи говурма."
2,Постный плов,"Рис (""Мистраль"") — 500 г | Морковь — 3 шт | Лук репчатый — 2 шт | Масло растительное | Барбарис | Приправа (зира, вегетта) | Соль | Чеснок — 1 шт","Используемые продукты. | Лук порезать полукольцами, | морковь соломкой. | Казан с маслом накалить и пожарить лук до золотистого цвета. | Добавить морковь. | Зиру перемолоть в ступе | и вместе с барбарисом приправить наши овощи. Залить кипятком, положить 1 столовую (без горки) ложку Вегетты и дать немного провариться. | Головку чеснока почистить от шелухи, промыть и положить в центр зирвака. | Рис промыть в воде несколько раз. Уложить на готовый овощной зирвак и залить кипятком. Уровень воды, как обычно, должен быть выше риса на два пальца. Добавить половину столовой ложки Вегетты. Не мешая риса, прибавить огонь и дать воде выкипеть. | Убавить огонь. Из риса сделать горку и накрыть крышкой. Пусть рис готовиться 25-30 минут. По истечении времени выключить огонь, и не открывая крышки, оставить казан с рисом на 15 минут. Затем перемешать рис шумовкой для равномерного распределения зирвака."
4,Гречаники,Крупа гречневая — 500 г | Картофель — 1 шт | Яйцо куриное — 3 шт | Соль (по вкусу) | Масло растительное (для жарки),"Гречку перебрать, отварить до готовности. Картофелину очистить, отварить до разваривания. Слить всю воду, сделать пюре, не добавляя ни масла, ни сметаны - ничего! | Гречку смешать с ещё тёплым картофельным пюре. Добавить яйца, соль по вкусу. Очень хорошо перемешать. | Полученную массу оставить до полного остывания. | Раскалить в сковороде постное масло. Формировать из гречневого фарша большие котлеты и выкладывать для обжаривания. Вначале обжаривать на большом огне. | Перевернуть гречаники на другую сторону, уменьшить огонь и обжаривать до золотистой корочки. | Готовые гречаники можно прекрасно употреблять с любыми дополнениями: с соусами, с гуляшом, а кто держит пост - с грибной подливкой."
5,Гречневые котлетки с сыром,Крупа гречневая — 300 г | Картофель — 2 шт | Яйцо куриное — 1 шт | Сыр твердый (у меня в Эдам) | Кубик бульонный | Соль | Перец черный | Сухари панировочные / Панировка,В воду добавить бульон и сварить в нем гpечку. | Отварить картошку и размять в пюре. | Вбить яйцo. | Добавить гречку и хорошо перемешать. Посолить и поперчить по вкусу. | Слепить лепешку и положить в середину кусочек сыра | Залепить сверху | Обвалять в сухарях и жарить в маcле с двух сторон до готовности. | Вот и всё!!! ПРИЯТНОГО АППЕТИТА!!!
6,"Ризотто с курицей, грибами и луком-пореем",Филе куриное — 250 г | Шампиньоны (замороженные) — 400 г | Лук-порей (белая часть) — 1 шт | Сливки — 100 мл | Вино белое сухое — 100 мл | Чеснок — 1 зуб. | Масло сливочное — 30 г | Масло растительное — 2 ст. л. | Базилик (сушеный) | Приправа (сухие травы) | Бульон (из куриного филе) — 1-1.3 л | Сыр твердый,"Отварить куриное филе в 1,5 л воды. | На разогретом оливковом масле в течение 3-4 минут обжарить зубчик чеснока, затем вынуть его и выбросить. | Добавить лук-порей, нарезанный полукольцами. | Отварное филе разобрать на кусочки. Грибы разморозить, подогреть и выпарить лишнюю воду. К луку-порею добавить кусочки филе, грибы, сливочное масло и перемешать. Тушить в течение 5 минут. | Добавить рис. Влить вино и тушить до испарения вина. Посолить, добавить специи, перемешать. | Затем по 1 половнику вливаем куриный бульон, бульон должен покрывать рис, когда бульон выпарится, вливаем следующий половник, таким образом выливаем всю порцию бульона и готовим ризотто в течение 15-20 минут. | В конце процесса приготовления вливаем сливки, даем им выпариться. Посыпаем ризотто частью сыра и перемешиваем, остальной сыр используем при подаче блюда. | Готовое блюдо выложить на подогретую тарелку (дабы избежать прилипания риса), посыпать сыром и.... Приятного аппетита!:)"
7,Биточки из манной крупы,Крупа манная — 50 г | Сахар — 1 ст. л. | Соль | Масло сливочное — 1 ст. л. | Яйцо куриное — 1 шт | Молоко — 125 мл | Масло растительное (для жарки),"В кипящее молоко всыпать манную крупу, размешать, добавить соль и сахар по вкусу, проварить на небольшом огне до загустения. | Немного охладить, добавить яйцо и сливочное масло. | Вымешать. | Сформовать из массы небольшие биточки и обжарить в разогретом масле с двух сторон до зарумянивания. Подать со сметаной, киселем или вареньем. Я подавала с вишневым варением. [color=darkred]Прият ного аппетита!!![/color]"
8,Ризотто с куриной печенью,Печень куриная — 300 г | Рис — 275 г | Вино белое сухое — 200 мл | Лук репчатый — 1 шт | Сельдерей черешковый — 1 шт | Чеснок — 1 зуб. | Масло оливковое — 4 ст. л. | Петрушка | Перец черный | Соль (морская) | Масло сливочное — 1 ст. л. | Перец душистый (горошком),"В кастрюле вскипятите воду, добавив в нее душистый перец. Лук, чеснок и стебель сельдерея мелко порубите. | В большой сковороде разогрейте 3 ст. ложки оливкового и 1 ст. ложку сливочного масла. Слегка обжарьте лук, чеснок и сельдерей до прозрачности лука. Промойте куриные печенки и просушите их бумажным полотенцем, затем добавьте их к луку и сельдерею, прожарьте 2-3 минуты. | Добавьте рис, как следует перемешайте, оставьте на 2-3 минуты. Затем влейте вино, дайте рису покипеть и увариться. | Постепенно, половник за половником, добавляйте кипяченную с душистым перцем воду, постоянно помешивая. Кастрюльку с водой лучше держать на маленьком огне, так как добавляемая жидкость должна быть горячей. Рис должен впитывать жидкость, а не плавать в ней, поэтому не следует сразу наливать несколько половников жидкости. Весь процесс приготовления должен занять около 20 минут. | Готовое ризотто поперчите слегка, посолите по вкусу, добавьте 1 ст. ложку оливкового масла и порубленную зелень петрушки. | Приятного аппетита!"
9,Заменитель хлеба,"Крупа ячневая — 0,5 пакет. | Петрушка (чем больше, тем лучше) | Вода (крутой кипяток)","Петрушку помыть и обсушить. | Крупу перемолоть в кофемолке. | В глубокую миску высыпаем перемолотую крупу, добавляем мелко нарезанную петрушку, запариваем всё кипятком, тщательно перемешав. Должна получиться очень густая каша. | Всё выкладываем на разделочную доску. Выравниваем края. Высота, примерно, 0,5см. | Сразу нарезаем на кусочки-ромбики. Сушим, периодически переварачивая. | У меня он сушился примерно день. Хранила в холодильнике не закрытым. Попробуйте, очень полезно и мне понравилось на вкус, а главное - практически без коллорий!"
10,Очень ленивое ризотто по-русски,"Рис — 2 стак. | Филе куриное (или любого другого мяса) — 700 г | Овощи (овощной микс, отцедить из банки) — 1 бан. | Лук репчатый — 1 шт | Чеснок (головка) — 1/2 шт | Соль | Приправа (по вкусу) | Вода (кипяток) — 3 стак. | Перец черный","Все, что нам понадобится | Рис как следует промыть, глубокую форму для запекания смазать маслом. Рис высыпать в форму и разровнять, приправить по вкусу. | Лук порезать кубиками, овощной микс отцедить из банки и равномерно разложить поверх риса вместе с луком. Я еще разложила неочищенные дольки чеснока. | Мясо разложить поверх овощей, посолить, поперчить, добавить любимых приправ. Залить 3 ст. кипятка и накрыть сверху фольгой. Ставим в духовку разогретую до 200 С, где-то на 1-1,5 часа. А вообще все зависит от духовки и от того, какое мясо вы возьмете | У меня приготовилось за час, я даже немного передержала, просто не ожидала, что так быстро приготовится! Может из-за того, что я намочила пергамент и полностью закрыла содержимое формы, а сверху еще и фольгой накрыла (фольги оказалось впритык, были щели и я побоялась, что будет долго запекаться, поэтому перестраховалась пергаментом). На удивление все быстро, никакой послеготовочной грязи и посуды, а главное очень вкусно! Приятного!!!"
11,Гречневые оладьи с грибами и соусом,"Крупа гречневая — 1 стак. | Яйцо куриное — 1 шт | Сметана — 1 ст. л. | Грибы (вешенки,в оладьи) — 100 г | Мука пшеничная / Мука — 3 ст. л. | Соль (по вкусу) | Огурец соленый (для соуса) — 1 шт | Майонез (или сметана,для соуса) — 2 ст. л. | Зелень (любая,для соуса) — 50 г","Из гречневой крупы сварить кашу на воде, посолить. | Грибы нарезать, обжарить. | К готовой гречневой каше добавить грибы, | Яйцо, сметану, | Муку. Хорошо перемешать. | Выкладывать ложкой на сковороду в разогретое растительное масло. Обжарить с двух сторон. | Для соуса: Огурец нарезать небольшими кубиками (или натереть на терке). | Зелень мелко порубить. | Соединить сметану, зелень, огурец, хорошо перемешать. | Разложить на блюде оладьи, на середину выкладываем соус. Приятного аппетита."
12,Манные зразы с маком,"Мак — 100 г | Сахар (1 ст.л.в начинку, 3 ст.л. в кашу) — 4 ст. л. | Молоко (у меня 3.2 %жирности) — 500 мл | Яйцо куриное — 1 шт | Крупа манная — 6 ст. л. | Масло сливочное — 50 г | Мука пшеничная / Мука","Это продукты, которые нам понадобятся. | Мак залить кипятком на 1 час. Потом откинуть его на марлю, чтоб стекла вода, добавить в мак сахар и начинка ГОТОВА! Из молока, сахара и крупы сварить густую кашу, добавить масло и снять с огня. ОСТУДИТЬ!!! В кашу добавить яйцо и хорошо перемешать, добавить муку, чтоб тесто из манки получилось более клейкое. | Просеиваем на подложку муку, на муку выкладываем столовой ложкой тесто и формируем лепёшечку :) На неё кладём чайную ложку маковой начинки. | На начинку снова столовую ложку теста. Верхним слоем манки мы закрываем начинку. | присыпаем мукой | На раскалённую сковороду с маслом аккуратно лопаткой (т.к. зразики очень нежные) выкладываем манные зразы и обжариваем с двух сторон до румяного цвета. Готово!!! Можно кушать с мёдом!:) | а можно и с ежевичкой :) Приятного Вам завтрака!!!"
13,"Гречка ""Мужская фантазия""",Сосиска — 1 шт | Крупа гречневая — 5 ст. л. | Яйцо куриное — 2 шт | Сыр твердый | Майонез | Кетчуп | Огурец (соленый) — 1 шт | Чеснок | Масло растительное,"Обжарить сосиски с двух сторон. | Добавить гречку. Через пару минут добавить солёный огурец, порезанный кружочками. | Расколоть 2 яйца. | Посолить, перемешать. Добавить чеснок, порезанный кружочками или измельченный. | Натереть на мелкой терке сыр, добавить к нему майонез, кетчуп. Всё тщательно перемешать. | Выложить равномерным слоем на сковороду. Не размешивая, продолжать запекать парочку минут на медленном огне. | При подаче украсить зеленью. [b][color=red]Приятного аппетита!!![/color][/b]"
14,Сырно-рисовые котлеты,Рис (вареный) — 2 стак. | Сыр твердый — 160 г | Яйцо куриное — 2 шт | Лук репчатый — 1 шт | Мука пшеничная / Мука — 2 ст. л. | Карри — 1/2 ч. л. | Сухари панировочные / Панировка — 3 ст. л. | Масло растительное (для жарки) | Соль | Перец черный (молотый),"Лук мелко порубите и обжарьте на 1 ст. л. масла при постоянном помешивании. | Рис смешайте с луком, взбитыми яйцами, солью, перцем, с тёртым на мелкой тёрке сыром, мукой и карри. | Сформируйте котлеты и обваляйте их в сухарях. Обжарьте на растительном масле до образования золотистой корочки. | Приятного аппетита!"
