,title,ingredients,instructions
288,Паэлья с морепродуктами,Рис (белый среднезерный «Арборио») — 500 г | Филе рыбное (белых рыб) — 300 г | Креветки (королевские и тигровые) — 10 шт | Коктейль морской — 500 г | Помидор (сезонный сладкий) — 3 шт | Помидоры черри — 10 шт | Перец болгарский — 1 шт | Сельдерей черешковый (стебель) — 1 шт | Горошек зеленый (сезонный или замороженный) — 100 г | Зелень (петрушки и кинза) — 1 пуч. | Орегано — 1/2 ч. л. | Шафран (щепотка нитей) | Масло растительное — 100 мл | Лимон — 1 шт | Бульон (овощной или рыбный) — 750 мл | Масло сливочное — 50 г | Вино белое полусладкое — 100 мл | Соль (по вкусу) | Чеснок — 2 зуб. | Лук белый — 1 шт | Перец чили (по вкусу),"Морскую рыбу (у меня сибас) очистить, филетировать, нарезать ровными кусочками, быстро слегка обжарить на разогретой сковородке с растительным маслом (только подрумянить, не до готовности!). Переложить в мисочку и накрыть фольгой. Из голов, хвостов и костей сварить бульон (~ 750 мл), я добавила к нему стебель сельдерея, кинзу и петрушку. Посолить по вкусу, процедить. | Креветки постепенно разморозить в холодильной камере, очистить от панциря, голов и кишечной вены (я оставила хвостики). Панцири и головы обжарить на сливочном масле до порозовения, залить водой (~ 300 мл) и белым столовым вином (~ 100 мл), посолить по вкусу, уварить жидкость наполовину, процедить через сито. Получится ароматный креветочный отвар, примерно 150-200 мл. | Креветки быстро обжарить на растительном масле до порозовения, можно присыпать чуть розмарином (если любите!). У меня было пустое место на сковородке - я бросила помидорки черри. Отложить к рыбе, накрыть фольгой. | Морской коктейль у меня уже готовый к употреблению, его нужно постепенно разморозить в холодильной камере, лишнюю жидкость слить. Я его слегка прогрела на разогретой с растительным маслом сковородке. | Сезонные помидоры бланшировать пару минут в кипятке, очистить от кожицы, пюрировать. Добавлять по вкусу. | Нити шафрана залить бульоном или водой, дать настояться. | Лук и красный болгарский перец нарезать кубиками, обжарить на растительном масле до прозрачности лука, под конец добавить чеснок, обжарить пару минут. | Для приготовления паэльи я использовала рис белый среднезерный «Арборио» от Мистраль. | Готовить паэлью лучше на широкой толсто стенной сковородке. Bсыпать рис, обжаривать несколько минут, периодически перемешивая, чтобы он пропитался маслом и прогрелся. Всыпать горошек, перемешать. Посыпать орегано, хлопьями перца чили. | Соединить рыбный бульон с креветочным отваром, пюрированными помидорами (по вкусу). Залить рис этим бульоном (примерно около литра). Жидкость должна покрывать рис. Сначала готовить 5-7 минут на сильном огне, затем выложить в рис подготовленную рыбу, морской коктейль, креветки, помидорки черри, уменьшить огонь до слабого и варить ещё 15 минут, не перемешивая. | В конце приготовления можно увеличить огонь на несколько минут, чтобы снизу образовалась румяная корочка. Выключить огонь, накрыть паэлью (сковороду) полотенцем или бумагой (не крышкой!) и оставить постоять 10 минут. Посыпать петрушкой и кинзой, подать на стол прямо в сковороде с ломтиками лимона."
289,"Ризотто ""Пьемонт""","Рис (Арборио от ""Мистраль"") — 400 г | Свинина — 300 г | Яйцо перепелиное — 2 шт | Пармезан — 100 г | Бульон (говяжий) — 2 л | Вино розовое полусухое — 6 ст. л. | Сухари панировочные / Панировка — 4 ст. л. | Лук репчатый (среднего размера) — 3 шт | Масло сливочное — 120 г | Масло оливковое — 4 ст. л. | Чеснок — 2 зуб. | Паприка сладкая — 1 ч. л. | Орех мускатный — 1/2 ч. л. | Соль (по вкусу)","Вот наши продукты. | Из свинины приготовить фарш (я это сделала заранее), добавить лук (1шт), перепелиные яйца, мускатный орех, пармезан 2-3 ст. л. и соль по вкусу. Хорошенько перемешать. | Сформировать фрикадельки, обвалять их в панировочных сухарях. | Обжарить фрикадельки в оливковом масле на сильном огне до готовности. | Из сливочного масла и нарезанного лука (2шт) приготовить софрито. Так называется база для ризотто. В удобной посуде растопить масло и припустить в нем лук. | Промываем рис. | Затем рис выкладываем в подготовленную базу, добавляем вино, солим по вкусу, посыпаем паприкой. Держим на среднем, равномерном огне. | Затем небольшими порциями доливаем бульон. Таким образом доводим рис до готовности. | Чеснок мелко нарезаем. | Снимаем ризотто с огня, добавляем фрикадельки. | Подаем к столу, посыпав чесноком и оставшимся пармезаном."
290,Паэлья на пиве с лососем и кальмарами,"Лосось — 200 г | Кальмар (тушка) — 1 шт | Пиво темное — 4 ст. л. | Лук-порей — 1 шт | Перец болгарский — 1 шт | Лимон — 1/2 шт | Мука пшеничная / Мука — 3 ст. л. | Укроп — 1 пуч. | Масло оливковое — 4 ст. л. | Бульон (куриный) — 600 мл | Рис (Арборио ""Мистраль"") — 220 г | Шафран — 1/2 ч. л. | Перец душистый — 1/2 ч. л. | Соль (по вкусу)","Вот наши продукты. | Шафран залить небольшим количеством горячей воды. | Кальмары нарезаем кольцами, филе лосося - небольшими кусочками. Все обваливаем в смеси муки и черного перца, выкладываем на отдельную сковороду с разогретым оливковым маслом (2ст. л.) и обжариваем до готовности. | Оставшееся оливковое масло выливаем на раскаленную сковороду, добавляем порезанный лук-порей и сладкий перец, солим и обжариваем в течении 5 минут. | Бульон перемешиваем с пивом и шафрановой водой, ставим на огонь, помешивая доводим до кипения. | В сковороду к обжаренному луку и перцу выкладываем рис слоем приблизительно 1,5 см, вливаем бульонную смесь, не перемешивая, тушим на слабом огне 15 минут. | Затем необходимо перемешать. Вот так у нас получается. | Далее добавляем обжаренную рыбу и кольца кальмара, аккуратно перемешиваем и готовим все вместе еще 5 минут под крышкой. | Паэлья готова. Подаем ее к столу с веточками укропа и кружочками лимона."
291,Паэлья с морепродуктами,"Рис (не полный стакан круглозерный ""Арборио"" от ТМ ""Мистраль"") — 1 стак. | Кальмар (больших тушки) — 2 | Креветки (у меня свежие) — 250 г | Мидии (у меня свежие) — 450 | Помидор (больших) — 2 шт | Лук репчатый (большая луковица) — 1 шт | Горошек зеленый (свеже мороженный) — 0.5 стак. | Шафран — 1 ч. л. | Лимон — 1 шт | Масло оливковое — 30 мл | Соль (по вкусу) | Перец сладкий зеленый — 1 шт | Чеснок — 3 зуб.","Первым делом нужно подготовить помидоры и овощи. Помидоры обдать кипятком, снять кожу и порезать небольшими кубиками, поместить в мисочку и слегка присолить, порезать сладкий зеленый перец и отправить к помидорам. Почистить и порезать чеснок кружочками, отпавить в миску к помидорам и перцу. | Отварить креветки в соленой воде | В этой же воде отварить мидии (предварительно промываем, каждую ракушку чистим щеткой), когда ракушки раскроются, значит мидии готовы. | Бульон после варки морепродуктов процедить. Мне понадобился полный стакан бульона, в котором я развела шафран. | Кальмары порезать кольцами, у меня были уже очищенные кальмары. Если у Вас они в кожице, не беда, обдайте их кипятком, уберите внутренности. | Рис хорошо промываем. Круглозерный рис ""Арборио"" от ТМ ""Мистраль"" идеально подходит для приготовления данного блюда. | Репчатый лук порезать кубиками. Разогреть оликовое масло в сковороде с толстым дном и стенками. Лук обжарить до прозрачного состояния. | Давлее добавляем помидоры, чеснок и сладкий перец, обжариваем несколько минут на сильном огне. | Добавляем кальмары. Обжариваем 1 минуту. | Добавляем рис | Рис обжариваем-2-3 минуты, чтоб он в себя впитал все ароматы. | Далее выливаем бульон с шафраном. Выкладываем горошек. У меня бульон оказался хорошо соленым, соли я больше не добавляла. уменьшаем огонь до минимума, и готовим под закрытой крышкой, около 15-20 минут. За 2-3 минуты до окончани готовки, выкладываем креветки и мидии. Выключаем огонь и держим паэлью несколько минут. Обязательно поливаем паэлью соком лимона. Сразу подаем к столу и кушаем горячую. Очень хорошо под белое вино."
292,Паэлья с морепродуктами и курицей,"Филе куриное (400 г) — 1 шт | Колбаски (острые чоризо) — 100 г | Лук репчатый (средняя головка) — 1 шт | Шампиньоны — 200 г | Шафран — 1 щепот. | Чеснок — 3 зуб. | Томаты в собственном соку — 1 бан. | Перец чили — по вкусу | Вино белое сухое — 300 г | Бульон (куриный) — 600 г | Масло оливковое — 3 ст. л. | Рис (""Арборио"" от Мистраль) | Оливки зеленые (большая) — 1 горст. | Горошек зеленый (большая) — 1 горст. | Мидии (в ракушках) — 1 кг | Креветки (тигровые) — 150 г | Кальмар (большой) — 1 шт | Соль (морская) — по вкусу | Сахар коричневый (или по вкусу) — 1 ст. л. | Зелень (петрушка или базилик для подачи)","Если мидии свежевыловленные, их следует хорошо промыть под проточной водой со щеткой. | В кастрюлю с толстым дном выложить небольшое количество мидий, поставить на плиту на сильный огонь. Через 1-1,5 минуты мидии начнут выделять сок и раскрываться. Нераскрывшиеся мидии следует выбросить - они неживые. | Держать мидии на огне в собственном соку следует минуту - полторы. Потом они доготовятся вместе с рисом. | Удалить водоросли, на которых мидия держится в море за пирс или камни. Этим процессом у меня занимается муж (он же их и ловит в море:)). | В небольшом количестве оливкового масла обжарить мелко нарезанное куриное филе с колбасками чоризо (у меня в этот раз без них, было и так достаточно остро). | Добавить нарезанный репчатый лук, через пару минут, как только лук станет прозрачным, добавить нарезанные грибы. | Мелко порубить чеснок и перец чили, добавить в сковороду, чуть обжарить, добавить рис. | Хорошо перемешать, прогреть минуту-две, чтобы рис впитал чесночно-перечное масло. | Добавить банку рубленых томатов в собственном соку. | Хорошо перемешать, влить сухое вино. | Когда вино немного выпарится, добавить горсть оливок, щепотку шафрана. | Влить куриный бульон, аккуратно перемешать. Посолить по вкусу, добавить немного коричневого сахара для баланса вкуса. Больше перемешивать паэлью нельзя. Накрыть крышкой и готовить на небольшом огне 7 минут. | Кальмара очистить от пленки, нарезать кольцами. Часть мидий очистить, часть оставить в ракушках. Креветки очистить от панциря, оставить хвостик, аккуратно потянуть за кишечник, его легко будет достать. Если используете варено-мороженые креветки, тогда надрежьте хвост по всей длине и промойте под проточной водой. | Спустя 7 минут поверху риса выложить морепродукты. | Сначала очищенные мидии. | Затем кольца кальмаров и креветки. | Затем мидии в ракушках. Посыпать зеленым горошком, накрыть крышкой и готовить еще 5-7 минут. | Вот какая красота получится в итоге. Выключить плиту, накрыть крышкой, дать постоять еще минут 5, чтобы все ароматы и вкусы смешались. | Подавать, посыпав рубленой зеленью. При желании можно подать дольку лимона для морепродуктов."
293,Калакифья гемиста,"Цуккини — 1 шт | Фарш куриный — 300 г | Рис (Индика ТМ ""МИСТРАЛЬ"") — 1/2 стак. | Мята — 1/2 пуч. | Лук репчатый — 1 шт | Лайм (сок) — 1/2 шт | Яйцо куриное — 1 шт | Укроп — 1/2 пуч. | Базилик — 1/4 пуч. | Чеснок — 1 зуб.","Берем цуккини длиной 25 см и режем его на 4 части. Вычищаем каждый кусочек от мякоти, оставляя стенки и дно и образуя стаканчик. Я ножом еще сделала на кожице цуккини рельефные надрезы. | Обжариваем на оливковом масле мелко порезанную луковицу и фарш до готовности. | В готовый фарш добавляем часть мелко порезанной зелени, отваренный до полуготовности рис Индика ТМ ""Мистраль"" и фаршируем наши цуккини. | Заливаем кабачки водой на 3/4, кладем соль, оставшуюся зелень и мелко порезанный чеснок и тушим на медленном огне 40-50минут. При помощи ножика попробуйте насколько мягкими стали кабачки, если нож проходит с легкостью- блюдо готово. | Приступаем к последнему этапу. Сок половинки лайма смешиваем с яйцом, хорошо взбиваем, добавляем немного горячего бульона из кастрюли с кабачками, чтобы яйцо не свернулось при вливании в бульон. | Осторожно вливаем лайм с яйцом в кастрюлю, хорошо встряхиваем и убираем с огня. | Наше блюдо готово!"
294,Морская паэлья,"Рис (Арборио ТМ Мистраль) — 200 г | Креветки (лучше королевские) — 150 г | Мидии (очищенные) — 150 г | Кальмар — 1 шт | Лук репчатый (лучше шалот) — 1 шт | Чеснок — 2 зуб. | Шафран — 0,5 ч. л. | Вода (горячая) — 0,5 стак. | Помидор (крупный) — 1 шт | Бульон (рыбный) — 350 мл | Вино белое сухое — 50 мл | Масло оливковое — 2 ст. л. | Соль (по вкусу)","Для паэльи лучше всего подходит рис Арборио. | На оливковом масле обжарить лук и чеснок. | Добавить нарезанные кальмары, креветки и мидии, готовить, помешивая. | Влить вино, дать выпариться спирту. | Шафран растворить в воде и влить в сковороду. Добавить мелко нарезанный помидор, перемешать. Готовить еще 2-3 минуты. | Всыпать рис, слегка перемешать и залить все бульоном. ***Для красоты я выловила креветки и разложила их сверху. | Готовить около 20 минут, затем оставить под крышкой еще на несколько минут. | Подавать паэлью с лимоном и петрушкой прямо в сковороде, но можно и разложить по тарелкам."
