,title,ingredients,instructions
165,"Бибимбап-рис, овощи, мясо и ваша фантазия","Рис (длиннозерный) — 300 г | Говядина — 100 г | Грибы (шиитаке, опята, шампиньоны или др.) — 100 г | Фасоль (стручковая) — 50 г | Лук зеленый — 30 г | Морковь (по-корейски, или свежая - мы ее быстро замаринуем) — 30 г | Капуста белокочанная / Капустa (по-корейски - кимчихи) — 30 г | Яйцо куриное — 1 шт | Перец болгарский — 30 г | Паста перечная (чили) — 2 ст. л. | Нори (лист) — 1 шт | Уксус (рисовый) — 3 ст. л. | Масло кунжутное — 3 ст. л. | Масло растительное — 3 ст. л. | Соус (устричный или соевый) — 2 ст. л. | Сахар — 1 ч. л. | Чеснок — 1/2 зуб. | Соль | Перец черный (свежемолотый)","Подготовим продукты. Выглядит ""бибимбап"" примерно так - только пока в сыром виде. Да, как вы уже поняли из описания, ""бибимбап"" - это смесь из любых овощей и риса. Я взяла те, что люблю сама, ну, и те, что были. Вы же можете взять и другие. В Корее в это блюдо часто добавляют всякие ростки, папоротник, огурец или цукини. Цвет ингредиентов играет огромную роль в ""бибимбап"" - корейцы считают, что располагать овощи, мясо и травы в тарелке ""бибимбап"" нужно таким образом, чтобы ""яркие цвета радовали глаз и возбуждали аппетит"". Учтите это, подбирая овощи для своей ""смеси риса и других продуктов"" :) | Рис промоем и отварим. Эта процедура стандартная и особых комментариев не требует. Единственное, что могу сказать (из личного опыта) - после того, как по всем вашим подсчетам рис уже готов и вода вся испарилась - не открывайте кастрюлю еще минут 10, дайте рису ""дойти"". | Пока варится рис, подготовим остальные ингредиенты. Для начала нарезаю тонкой соломкой мясо и мариную в смеси кунжутного масла (1 ст. л.), рисового уксуса (1ст. л.) и перца. В Корее чаще всего для этого блюда используют говядину, но встречаются варианты с куриным филе, свининой и даже осьминогом! | Морковь нарезаю соломкой и тоже мариную в смеси рисового уксуса (2 ст. л.), сахара (1 ч. л.) и растительного масла (1 ст. л.) | Болгарский перец - тоже соломкой. | Фасоль быстро обжарила на растительном масле, добавив немного соли. | Грибы - полукольцами. И тоже быстро обжарила, но уже без масла. | Теперь пора пожарить мясо. Все, как обычно - на раскаленной сковороде, до готовности (минуты 3, так как у меня говядина, и она была тонко нарезана и замаринована) | Теперь можно ""собирать бибимбап"": на дно большой миски выкладываем рис. В Корее для этого блюда есть специальная посуда ""dolsot"" - каменный горшок. У меня такого нет (у вас, скорее всего, тоже...). Но у меня есть чудесная деревянная посудина, по форме - ну точно ""dolsot""! | Теперь, по кругу, все наши ""заготовки"", чередуя цвета. | Да, лист нори просто нарезаем ножницами на тонкие полоски и так же, как и остальные ингредиенты, кладем в круг. В центр - соус, для которого смешиваем пасту чили, устричный (или соевый) соус, 2 ст. л. кунжутного масла и половину измельченного зубчика чеснока. | Финал - из яйца жарим глазунью и выкладываем ее в центр, прямо на соус. Есть и другие варианты, как поступить с яйцом: из него можно сделать омлет и, нарезав его традиционной соломкой, выложить в круг с остальными ингредиентами. А, если вы счастливый обладатель ""долсота"" - каменного горшочка, про который я писала выше, - можете смело выкладывать в центр ""бибимбап"" сырое яйцо (правда, если уверены в качестве и свежести оного :) - каменный долсот предварительно нагревают и уже с ""бибимбап"" ставят снова на огонь. Перемешивая рис с овощами, сырое яйцо соприкасается со стенками горячего горшочка и готовится. Глазунья - тоже вариант. | Вот и все! Очень просто и очень быстро! Пишу рецепт дольше, чем готовила! Да, из атрибутов выбранной страны - на заднем плане - Корейский национальный танец по корейскому телевизору LG!"
166,Рис с древесными грибами в омлете по- китайски,"Рис (длиннозерный, ориент) — 0,5 стак. | Вода — 1 стак. | Грибы (древесные или имеющиеся) — 0,4 шт | Чеснок (зубчики) — 3 шт | Лук зеленый — 50 г | Имбирь (корень, сантиметры) — 1 | Соевый соус (или соль по вкусу) — 3-5 ст. л. | Уксус (рисовый или обычный) — 1 ст. л. | Сахар ( ) — 1 ч. л. | Яйцо куриное (на 2 омлета) — 4 шт","Если вы будите использовать древесные грибы, то замочите их в холодной воде на 12-24 часа. | Древесные грибы продают в таких маленьких брикетах, в китайских магазинах, в отделах специй или на рынках, где торгуют «корейскими закусками». Эти грибы ещё называют свиные уши, так как они, по консистенции, напоминают хрящики свиных ушей. Грибы, при замачивании, увеличиваются в объеме раз в 10(!), поэтому не жалейте воды. Если нет таки грибов – подойдут и шиитаке, и наши Российские. | Теперь рис. Берите длиннозёрный, который после варки хорошо сохраняет форму. Замечательно, если вы приготовите на пару, тогда рис больше сохранит свой аромат и форму. Я в этот раз отварила полстакана риса на 200 мл воды. Делаю это так: рис промыть в восьми водах (магическое китайское число!). Залить водой, довести до кипения, убавить огонь, закрыть крышкой и варить 10-15 минут. Выключить, оставить под крышкой. Вроде всё просто, но приготовление простого, правильного риса - целое искусство, здесь главное - чутьё и опыт. Ведь рис не должен подгореть и не должен остаться лежать в воде, не должен развариться и потерять форму и не должен быть с жёсткой сердцевиной. Ещё, очень желательно, его не мешать. | Пока варился рис, мы приготовили всё остальное. Главное в китайской кухне - все ингредиенты должны быть подготовлены до начала готовки, так как сам процесс термической обработки занимает, в основном, считанные минуты. Итак: грибы - промыть, нарезать на тонкую лапшу, удаляя твёрдое основание. Чеснок - раздавить, нарезать не мелко. Имбирь - чистим; если молодой, то натрём на тёрке, если старый, как у меня, режем на кусочки, а после обжарки достанем. Перья лука - помоем, нарежем. Смешаем ингредиенты для соуса - уксус, соевый соус, сахар. | Приготовим чайную ложку китайской приправы «5 специй». Эта специя № 1 в Китае, состоит из семян аниса, корицы, гвоздики, корня солодки, фенхеля. Добавляют её везде - и в маринады для мяса, и в соусы и в десерты, а в нашем случае в рис. Если у вас её нет - подберите специи на свой вкус. Масло, в идеале, кунжутное наготове. Берём сковородку для приготовления начинки, в идеале вок, у меня проверенный чугунный сотейник, накаливаем и понеслось (пока в замедленном виде). Пока греется сковорода... | Вот оно моё сокровище, весом 270 г. В сравнении с куриным 46 г, гусиное просто гигант, а какие у него крепкие и толстые стенки, наверное, тоже раза в три толще куриных. Разбиваем, а там ещё одно удивление - | ярко жёлтый, огро-о-омный желток и совершенно прозрачный белок. Добавим пол скорлупки воды на яйцо и взобьем, соль по желанию. Теперь понеслось! | На сковородку наливаем масло, через 5 секунд - чеснок, имбирь, часть лука. Как только почувствуем, что чеснок хочет румяниться, примерно через минуту, | положим специи, перемешаем, вливаем соус, | когда он чуть выпарится, положим грибы и оставшийся лук, через минуту-две - | достанем имбирь, положим рис, | перемешаем и отставим в сторону. | Пока готовилась начинка, мы умудрились накалить плоскую сковороду для омлета. Здесь тоже есть секрет. Успех омлета в простых правилах: 1. раскалить сковороду, влить масло, 2. налить яичную смесь, распределить по всей сковородке и 3. встряхнуть из стороны в сторону. 4. выключить огонь и накрыть на несколько секунд крышкой. Всё! Омлет готов за считанные секунды. | На центр омлета выкладываем начинку. | С помощью лопатки заворачиваем края - так. | Так. | Выкладываем на тарелку. Надрезаем, украшаем, подаём с зеленью и овощами по вашему вкусу. | Уф! Писать гораздо дольше, чем готовить, а есть и того быстрее. Добавлю, что из гусиного яйца у меня вышло две порции омлета. Из куриных 2 омлета из 4 яиц. Теперь точно ВСЁ!"
167,Кичари,"Рис (басмати) — 1 стак. | Маш (лущёный, или чечевица красная) — 0,5 стак. | Вода — 6 стак. | Масло топленое (ги, в пост растительное) — 3 ст. л. | Гвоздика — 2 шт | Корица (целая, сантиметр) — 1 | Карри (листья) — 3 шт | Горчица (чёрная) — 1 ч. л. | Куркума — 0,5 ч. л. | Соль — 1 ст. л.","Главная отличительная черта индийской кухни в приготовлении пищи - обжаривание специй в масле. Обжаривание помогает раскрыть вкус специй - высвобождая эфирные масла и насыщая ими масло основу (ги или кунжутное масло). Правило - в раскаленном масле сначала обжариваются целые специи, потом молотые и свежие, как имбирь, чеснок, перец чили. | Рис и маш промоем в воде, пока вода станет прозрачной. Откинем на дуршлаг. В глубокой толстостенной сковороде или кастрюле нагреем масло, положим корицу, гвоздику, семена чёрной горчицы, когда горчица начнёт потрескивать, добавим листья карри и куркуму, перемешаем. | Добавим рис с машем, перемешаем, зальем водой посолим. Доведём до кипения, убавим огонь, накроем крышкой. | Всё очень просто - кичари, через 20 – 25 минут, готово! Для разгрузочных дней блюдо употребляют так, как приготовлено. Во все остальные дни блюдо, обильно поливая соком лайма, посыпают зеленью и едят с индийским «хлебом» пури, чапати, наном или паратхи. Если человек верующий, он перед тем, как сам будет есть эту пищу, преподнесет часть на алтарь и предложить её Богу, для освещения. Такая освещённая пища, в Индии, называется - прасад. И главное, такую пищу нужно готовить с любовью, молитвой и не пробовать во время готовки, так- как первым её должен попробовать Бог."
168,Рис в крапинку,"Мак (чёрный) — 1 ст. л. | Горчица (чёрная) — 1 ч. л. | Вода — 1 стак. | Рис (басмати) — 0,5 стак. | Масло топленое (ги) — 1 ст. л. | Соль — 1 ч. л.","Минимальный набор. Главное - хороший рис. | В раскалённое масло положить семена горчицы, когда они только начнут лопаться (будьте осторожны, они быстро начинают лопаться и разлетаться), | Добавьте мак, перемешайте, подержите на огне несколько секунд, | Всыпьте рис, перемешайте, залейте водой, посолите. | Перемешайте, залейте водой, посолите. | Доведите до кипения, закройте крышкой и варите 10 минут на слабом огне. Наш индийский гарнир готов! | Наш индийский гарнир готов! Традиционно в Индии почти все блюда обильно поливают соком лайма. Рис не исключение. К рису подают всевозможные «топинги» - чатни (соусы), райты (салаты с йогуртом) и пикули (маринованные в масле с приправами овощи или фрукты), запивают ласси (сладкий или солёный йогурт со специями, взбитый с водой)."
169,Рис по-болгарски,Масло сливочное — 1 ст. л. | Лук репчатый — 1 шт | Рис — 1 стак. | Соль (по вкусу),"В сковороде растопить сливочное масло. Небольшую луковицу мелко нарезать и немного поджарить (я жарю до золотистого цвета, для мужа). | Добавить рис и обжарить его до прозрачного состояния, это займёт буквально минутку. | Переложить рис в форму для запекания. | Залить водой (автор предлагает пропорции 1:2, у меня получается 1:3, может быть, зависит от риса, но я всегда пользуюсь такими пропорциями; у меня 1:2 - получается рис ""на зубок""), посолить. И хочу добавить, что я пользуюсь длиннозёрным пропаренным рисом. Если использовать белый круглый рис, лучше воспользоваться пропорцией 1:2. | Накрыть крышкой или фольгой. Отправить в предварительно разогретую до 200 градусов духовку на 35-45 минут или до готовности риса. | Рис готов! | Перед подачей рис можно посыпать свежемолотым перцем. Подавать как гарнир к любым блюдам. У нас была тушёная курочка, но заснять не успела!!! | Приятного аппетита!!!"
170,"Плов ""Озорник""",Рис (круглый) — 2 стак. | Морковь (небольшая) — 6 шт | Лапша (тонкая паутинка) — 400 г | Грибы (шампиньоны) — 400 г | Лук репчатый — 3 шт | Масло растительное (для обжаривания) — 4-5 ст. л. | Специи (для плова) — 3 ст. л.,"Паутинка - это название тонкой лапши, а не шали для тепла... А душу греет... И готовить приятно. Морковь, рис, шампиньоны, специи - можно и свои грибочки, лесные, собственноручно собранные... Вот и все ингредиенты. | На сухой сковороде начинаем обжаривать паутинку... | В другой сковороде - лучок (по желанию), морковь... Все обжариваем на растительном масле и до полуготовности... | Не забудьте помешивать паутинку... почаще... вот она какая получается веселая... | А тем временем в кастрюле уже должен готовиться рис. Я почему-то люблю круглый, шлифованный - он не разваривается и получается рисинка к рисинке. Добавляем к нему лапшу, морковь и продолжаем тушить под крышкой. | Быстро достаем замороженные или свежие шампиньоны, бросаем на раскаленную сковороду и через пять минут бросаем в кастрюлю с пловом... | А теперь самое главное - не упустить момент! Все хорошо и аккуратно перемешиваем, еще буквально пять минут - выключаем огонь и укрываем пловик теплым полотенцем... минут на 15. Я всегда так делаю, по старинным заповедям моей бабушки... Хотя сейчас - и с пылу, с жару все едят! Ну, вот теперь можно и в тарелку... Добавляем немного корейской моркови, зелени - и вот пожалуйте на дегустацию... | Мне даже самой понравилось. И на вкус, и на цвет... Пробуйте, угощайтесь. Мои домашние немедленно попросили повторения. И так продолжалось дня три... ПРИЯТНО... ГО... АППЕТИТА!"
171,Тайны приготовления коричневого риса,Рис (коричневый) — 1 стак. | Вода (холодная) — 3 стак. | Соль (по вкусу) | Масло оливковое — 2 ст. л.,"Я очень люблю коричневый рис, но он у меня никогда не получался. То не доварится, то переварится.... А недавно зашла в гости к моей подруге, и она угостила меня этим рисом. Вкус бесподобный. Рис рассыпчатый, вкусный, просто объедение!!! Я конечно же стала ""выпытывать"" все тайны его приготовления. Результат был потрясающий! Вот спешу поделиться с вами! Рис хорошо промыть холодной водой. Вода, которая стекает, должна быть прозрачной. | В хорошо разогретый вог наливаем масло и кладем рис. Постоянно помешивая, ждем, когда он немного подсохнет. Масло будет как бы обвалакивать рис. Это предотвратит склеивание риса при дальнейшей варке. | Затем наливаем воду, перемешиваем один раз и оставляем на сильном огне до закипания воды. | Как только вода закипит, уменьшаем огонь до минимума, закрываем крышку и оставляем до полного впитывания воды. | Получается вот такой рис. Выключаем газ, закрываем его крышкой и оставляем томиться минут на 30."
