,title,ingredients,instructions
401,Гречотто,Крупа гречневая — 1 стак. | Грибы (сушеные белые) — 100 г | Лук репчатый — 1 шт | Морковь — 1 шт | Чеснок — 3 зуб. | Соль (по вкусу) | Смесь перцев (по вкусу) | Перец душистый (горошком) — 4 шт | Вода — 1 л,"Сушеные белые грибы заливаем литром горячей кипяченой воды. Даем постоять 20-25 минут. Сцеживаем воду в отдельную посуду, а грибы режем соломкой. | Крупу высыпаем в кастрюлю и заливаем водой. Уровень воды выше крупы на 1 см. Варим до состояния al dente.)))Вообще этот термин в Италии применяют в основном к пасте (макаронам), но и гречотто, тоже вроде как слово итальянское... Короче говоря, варим до состояния, когда крупинки только начинают раскрываться. Снимаем с огня и сливаем воду. | Раздавливаем зубки чеснока ножом и режем мелко. | Лук чистим и режем четвертькольцами. | В сковороде на растительном масле обжариваем быстренько чеснок (на большом огне) и сразу же добавляем лук (огонь убавить до среднего). | Когда лук станет мягким, кладем грибы. Добавляем соль и перец по вкусу. Перемешиваем. Обжариваем минут 5-7. | Высыпаем гречку, перемешиваем. Добавляем воду, в которой были грибы. Не сразу всю. Подливайте понемногу. Может понадобиться не весь литр. Когда Когда получится кашицеобразная масса, накрываем крышкой и тушим минут 10. После того, как подлили последний раз ""грибную"" воду, добавьте перец горошком и лаврушку."
402,Котлеты из перловки с начинкой,Крупа перловая (ТМ Мистраль) — 100 г | Морковь — 1 шт | Лук репчатый — 1 шт | Чеснок — 2 зуб. | Соль (по вкусу) — 1/2 ч. л. | Перец черный (по вкусу) — 1/3 ч. л. | Крупа манная (ТМ Мистраль) — 3 ст. л. | Масло подсолнечное — 4 ст. л. | Сыр твердый — 50 г | Яйцо куриное (вареное ) — 1 шт | Укроп (зелень рубленая) — 2 ч. л. | Соль (по вкусу) — 1/4 ч. л.,"Крупу перловую отварить до готовности, как указано на упаковке. | Морковь и лук очистить, помыть. Лук мелко нарезать, морковь натереть на крупной терке. Обжарить лук и морковь на подсолнечном масле до мягкости. | Для начинки: сыр натереть на мелкой терке, добавить мелко нарубленное яйцо и зелень укропа, посолить. | Перловую крупу смешать с обжаренными овощами, мелко нарубленным чесноком и измельчить блендером. | Разделить крупяную массу на части. Из одной сделать котлеты. Другую массу сформировать в небольшие шарики. Взять шарик, расплющить и выложить в середину немного начинки, сформировать котлету. | Готовые котлеты обвалять в манной крупе. | Обжарить котлеты до золотистой корочки на подсолнечном масле с двух сторон. | Подавать котлеты к столу теплом виде с овощами или овощным салатом. Приятного аппетита!"
403,Перловка с овощами в томатном соусе,"Крупа перловая (ТМ ""Мистраль"") — 100 г | Лук репчатый — 1 шт | Морковь — 1 шт | Фасоль стручковая — 50 г | Горошек зеленый (консервированный) — 3 ст. л. | Огурец маринованный (среднего размера) — 1 шт | Помидор (свежемороженный , из собственных заготовок) — 1 шт | Сок томатный — 2 стак. | Зелень | Масло растительное — 2 ст. л. | Чеснок — 2 зуб. | Колбаски (копченые) — 150 г","Подготавливаем продукты. | Отмеряем необходимое количество крупы. Промываем ее, кладем в кастрюлю, добавляем воды ( 1:3), варим до готовности. | Нарезаем овощи. | Нарезаем колбаски. | В глубокую сковороду наливаем растительное масло. Выкладываем лук, чеснок и морковь. Обжариваем 5 минут. Затем добавляем стручковую фасоль и маринованный огурец. Обжариваем 5-7 минут. Затем добавляем помидор и зеленый горошек. Обжариваем еще 5 минут. Добавляем отварную перловую крупу. | Обжариваем 3-5 минут. | Делим блюдо на 2 части. В одну часть добавляем томатный сок и готовим еще 5 минут. | Во 2 часть добавляем нарезанные колбаски и томатный сок. Готовим 5 минут. | Подаем приготовленные блюда, добавив зелень."
404,Пастэ,Пшено (ТМ Мистраль) — 100 г | Крупа манная — 15 г | Вода — 370 мл | Соль (По вкусу) | Курица (Грудка) — 200 г | Кефир — 1 стак. | Пажитник (По вкусу) | Перец черный (По вкусу) | Майонез (Постный) — 3 ч. л. | Чеснок — 0.5 зуб. | Зелень (По вкусу) | Кефир — 3 ч. л.,"Начнём с того что приготовим курицу к нашему пастэ. Готовила дочь и, конечно-же, забыла сфотографироваь. Но тут всё и так понятно. Грудку режем на небольшие кусочки, отправляем в мультиварку или в сотейник. Заливаем кефиром. Добавляем соль, пажитник, перец. Тушим 25 минут. Теперь готовим пастэ. Нам потребуется пшено и манная крупа. У меня крупы от ТМ Мистраль. | В кипящую воду закладываем подготовленное пшено, снимаем пену, закрываем крышкой и варим 15 мин. | Затем в пшено, перемешивая ложкой, всыпаем манную крупу, и варим 12-15 мин. до загустения. | Готовое пастэ остужаем до температуры, при которой можно брать руками не обжигаясь. В Адыгеи выкладывают пастэ на стол, приминают руками и разрезают на порционные куски. Я воспользовалась кольцом для гарнира. | Постный соус мы приготовим из постного майонеза, размолотого чеснока и рубленой зелени. Скоромный соус готовим из кефира, размолотого чеснока, соли и рубленой зелени. Постную порцию поливаем соусом из майонеза. | Непостную порцию поливаем соусом из кефира и выкладываем рядом тушёную курицу. | Адыгейское блюдо пастэ готово. Пробуйте!"
405,Нежные котлеты из пшена,"Пшено (Мистраль) — 200 г | Вода (горячая) — 550 мл | Лук репчатый (средний) — 1 шт | Морковь (крупная) — 1 шт | Специи (соль, чёрный перец) — по вкусу | Коренья (сушеные, измельчённые - морковь, пастернак, сельдерей, петрушка + соль, куркума) | Масло подсолнечное — 35 мл | Сыр твердый (тёртый) — 50 г","Пшено Мистраль. | Пшено промыла под проточной водой. Залила горячей водой и варила 15 минут. Оставила его под крышкой. | Измельчила в измельчителе лук и морковь. Пассировала в разогретой сковороде в большом количестве подсолнечного масла до прозрачности лука. | Насыпала в вареное пшено сушеные, солёные с добавлением куркумы и измельчённые коренья. (Их сушу сама.) Добавила соль и перец. Переложила пассированные лук и морковь. Перемешала руками, чтобы не было комочков. | Сформировала котлеты и обваляла их в панировочных сухарях. На одну котлету - полторы ложки пшённого фарша. Получилось 20 штук. 6 жарила на масле для постящихся по 3 минуты с каждой стороны. | 12 штук разложила на противень, застеленный пергаментом. | Запекла в духовке с конвекцией при t 200 градусов в течение 15 минут, с тёртым сыром. | Котлеты жареные. | Котлеты, запечённые в духовке с сыром. | Жареные и запечённые котлеты одинаково сочные и вкусные. Сочность им даёт подсолнечное масло. С котлетами можно подать свежие, маринованные овощи и побольше зелени."
406,Перловка по-быстрому,Крупа перловая (Мистраль) — 100 г | Шампиньоны — 7 шт | Лук репчатый — 2 шт | Морковь — 1 шт | Чеснок — 1 зуб. | Масло растительное (для жарки) | Соль (по вкусу) | Перец черный (по вкусу) | Фарш индюшачий — 100 г,"Перловку промыть и замочить на ночь в холодной воде. Затем воду слить, перловку промыть, залить свежей водой в соотношении 1:2 и варить пока вода полностью не впитается, примерно 15-20 минут. | Фарш обжарить на растительном масле до готовности. | Грибы разрезать на четыре части. | Лук крупно порубить, морковь натереть на крупной терке, чеснок измельчить. | В сковороде разогреть растительное масло и обжарить грибы золотистого цвета, затем закинуть лук, обжаривать помешивая 2-3 минуты и закинуть морковь. Жарить все еще 5 минут, постоянно помешивая. Затем закинуть чеснок, посолить и поперчить по вкусу, перемешать. | В сковороду к обжарке выложить перловку, перемешать и готовить пару минут. Выключить и дать постоять под крышкой 5 минут. В не постную порцию добавить фарш и перемешать."
407,"Оладьи из овсяных хлопьев ""Растрепки""","Хлопья овсяные — 0,5 стак. | Капуста белокочанная / Капустa — 300 г | Лук репчатый — 1 шт | Укроп — 1 пуч. | Яйцо куриное — 1 шт | Мука пшеничная / Мука (с горкой) — 6 ст. л. | Соль — по вкусу","Овсянка у меня уже была заварена. Если брать сухие хлопья - нужно залить кипятком и подождать, пока разбухнут. Добавляем яйцо, солим. Перемешиваем хорошенько. | Режем капусту. Я люблю, когда капуста не очень мелко. Получаются красивые ""растрёпанные"" оладушки. Отсюда и название. | Лук режем мелко. | Измельчаем укроп. Можно при желании добавить зеленый лук. Получается не только вкусно, а еще и очень красиво. | Смешиваем все ингредиенты до однородности. Добавляем муку. Получается тесто слегка жидковатое. | Наливаем на сковороду подсолнечное масло. Выкладываем тесто ложкой. Сразу не очень красиво выглядит. Но в итоге получается очень аппетитно! | Жарим до золотистого цвета. Тесто не растекается сильно. Переворачиваются оладушки без проблем. В общем, жарим, как обычные котлетки. | Выкладываем на тарелку. И можно звать всех к столу. Капусточка слегка хрустит, овсяночка придает котлеткам мягкость... В общем, сложно описать, насколько это необычно и вкусно. Очень ароматные получаются оладушки! Стоит попробовать!"
408,Тушёная капуста по-белорусски,"Рис (""Кубань"" от ""Мистраль"") — 100 г | Капуста белокочанная / Капустa — 500 г | Лук репчатый — 1/2 шт | Морковь — 1/2 шт | Сахар — 1 ст. л. | Соус томатный — 2 ст. л. | Уксус (6% столовый) — 1 ст. л. | Лист лавровый — 1 шт | Перец черный (горошек) — 1/2 ч. л. | Вода (для варки риса и тушения капусты ) — 350 мл | Масло растительное — 2 ст. л. | Соль — 1 ч. л. | Масло топленое — 1 ст. л. | Фарш мясной (свиной) — 200 г | Соль — 1/4 ч. л.","Для приготовления берём рис ""Кубань"" от ""Мистраль"", хорошо промываем, заливаем водой в соотношении 1 к 2, доводим до кипения и варим на медленном огне 20 минут до полуготовности. | Пока варится рис, лук режем тонкими четвертинками и обжариваем на растительном масле (1 ст. ложка) до румяности. | Морковь трём на крупной тёрке, добавляем к луку и тушим 5 минут. | Капусту нарезаем тонкими полосками. Берём глубокую сковороду (сотейник), наливаем воду (100 мл), кладём порезанную капусту, поливаем 1 ст. ложкой растительного масла, кладём перец и лавровый лист, всё тушим на медленном огне 30 минут. | К капусте добавляем обжаренные лук с морковью, кладём томатный соус, соль, сахар, уксус, перемешиваем. Тушим 5 минут на медленном огне. | Добавляем готовый рис. | Перемешиваем, готовим 5 минут на медленном огне. | Откладываем половину готового блюда. Постное блюдо: капуста, тушёная с рисом - готово. | Готовим не постную добавку. На топлёном масле обжариваем свиной фарш. | Готовый фарш солим, разминаем толкушкой. | Обжаренный фарш добавляем к капусте с рисом, перемешиваем, прогреваем 5 минут. | Капуста, тушёная по-белорусски готова! | Подаём оба блюда горячими. Приятного аппетита!"
409,Гречаники со свеклой,"Крупа гречневая (отварная) — 150 г | Свекла (отварная) — 75 г | Горчица — 1,5 ч. л. | Чеснок — 1 зуб. | Смесь специй (для рыбы с орегано и укропом) — 0,5 ч. л. | Перец черный — по вкусу | Соль — по вкусу | Масло растительное — 2 ст. л. | Сухари панировочные / Панировка (для панировки) | Мука пшеничная / Мука — 2 ст. л. | Лук зеленый — по вкусу","Гречку измельчить погружным блендером (без фанатизма, пусть крупинки останутся) | Добавить тертую свеклу, измельченный чеснок и горчицу, перемешать. | Всыпать соль, перец и специи, перемешать. | Добавить мелко нарезанный зеленый лук, перемешать. | Всыпать муку, перемешать. | Сформировать 6 котлеток, запанировать в сухарях. | Обжарить на растительном масле с двух сторон до румяности. | Выкладывать на бумажное полотенце. | Подавать с любым гарниром (кроме гречки) или овощами."
410,"Рис ""Самарканд"" со свининой и колбасками","Свинина — 400 г | Колбаски — 200 г | Лук репчатый — 100 г | Морковь — 100 г | Специи (перец черный, кориандр молотый, пажитник, зира) — 1/3 ч. л. | Соль — по вкусу | Соус (хреновина или хренодёр) — 3 ст. л. | Вода — 3 стак. | Масло растительное — 4 ст. л. | Рис (""Самарканд"" от Мистраль) — 1,5 стак. | Сырок плавленый (70-80 г) — 1 шт","Нагрейте в сковороде масло и обжарьте кусочки свинины, приправьте её солью и специями. | Добавьте нарезанные лук и морковь и обжарьте их вместе с мясом. Добавьте в сковороду 3 ложки хреновины (или острой томатной аджики). | Всыпьте рис. Я решила использовать рис ""Самарканд"" от Мистраль. | Влейте горячую воду, накройте крышку и готовьте на малом огне 15 минут. Снимите с огня и оставьте еще на 10 минут. | Нарежьте ломтиками колбаски. | И натрите плавленный сырок. | Добавьте сырок и колбаски к рису и перемешайте."
411,Булгур с овощами и фрикадельками,"Фарш мясной — 600 г | Булгур (ТМ ""Мистраль"") — 1 стак. | Лук репчатый — 2 шт | Морковь — 2 шт | Карри — 1/2 ч. л. | Тмин — 1/4 ч. л. | Масло растительное — 3 ст. л. | Горошек зеленый — 100 г | Фасоль стручковая — 100 г | Соль — 1 ч. л. | Перец черный — 2 щепот. | Петрушка — 1/2 пуч.","Из смешанного мясного фарша (свинина+говядина) приправленного солью и перцем, скатать шарики. | На 1 ст л растительного масла обжарить мясные фрикадельки до легкого румянца. Выложить полуготовые фрикадельки на блюдо. | В сковороду долить 2 ст л растительного масла, выложить нарезанные на перья лук и соломкой морковь, обжаривать мин 5 до мягкости. Добавить молотый тмин и порошок карри, перемешать. | Всыпать булгур ТМ ""Мистраль"". | Влить примерно 2-2,5 стакана кипятка, приправить солью и перцем. | Выложить к булгуру полуготовые фрикадельки. Готовить на медленном огне мин 15. | Добавить замороженный горошек (у меня смесь горошка с морковью). | Также добавить зеленую замороженную стручковую фасоль. Готовить все вместе еще 5-10 мин. | Готовое блюдо присыпать рубленной петрушкой. Приятного аппетита!!"
